{
  "$schema": "https://wia.live/nano/v1/schema.json",
  "version": "1.0.0",
  "system_type": "nanorobot",
  "device": {
    "manufacturer": "WIA Medical",
    "model": "MedBot-500",
    "serial": "MB-2025-00042",
    "firmware": "2.1.0"
  },
  "timestamp": {
    "iso8601": "2025-01-15T14:23:45.123Z",
    "unix_ms": 1736951025123
  },
  "sequence": 89012,
  "environment": {
    "temperature_k": 310.15,
    "pressure_pa": 101325,
    "medium": "blood",
    "ph": 7.4,
    "ionic_strength_m": 0.15,
    "viscosity_pa_s": 0.004
  },
  "scale": {
    "length_unit": "micrometer",
    "time_unit": "millisecond",
    "mass_unit": "picogram"
  },
  "data": {
    "robot_type": "medical",
    "robot_id": "NBOT-MED-042",
    "dimensions": {
      "length_nm": 500.0,
      "width_nm": 200.0,
      "height_nm": 200.0
    },
    "position": {
      "x_um": 1250.5,
      "y_um": 3200.8,
      "z_um": 150.2,
      "coordinate_system": "body_relative",
      "reference_organ": "liver"
    },
    "orientation": {
      "quaternion": { "w": 0.707, "x": 0.0, "y": 0.707, "z": 0.0 }
    },
    "navigation": {
      "mode": "autonomous",
      "target_um": { "x": 1500.0, "y": 3500.0, "z": 200.0 },
      "algorithm": "a_star",
      "eta_seconds": 120.5
    },
    "propulsion": {
      "type": "flagellar",
      "speed_um_per_s": 50.0,
      "power_fw": 10.0,
      "efficiency_percent": 75.0
    },
    "sensors": [
      {
        "id": "glucose_1",
        "type": "chemical",
        "target": "glucose",
        "value": 5.5,
        "unit": "mmol/L",
        "accuracy": 0.95
      },
      {
        "id": "ph_1",
        "type": "ph",
        "value": 7.2,
        "accuracy": 0.98
      },
      {
        "id": "temp_1",
        "type": "temperature",
        "value": 310.15,
        "unit": "K",
        "accuracy": 0.99
      }
    ],
    "actuators": [
      {
        "id": "gripper_1",
        "type": "gripper",
        "state": "open",
        "grip_force_pn": 0.0
      },
      {
        "id": "injector_1",
        "type": "drug_injector",
        "payload_remaining_percent": 80.0
      }
    ],
    "communication": {
      "protocol": "ultrasonic",
      "frequency_mhz": 40.0,
      "signal_strength_dbm": -50.0,
      "last_contact_ms_ago": 100
    },
    "power": {
      "source": "glucose_fuel_cell",
      "level_percent": 75.0,
      "consumption_fw": 15.0,
      "estimated_runtime_h": 5.0
    },
    "mission": {
      "type": "drug_delivery",
      "status": "in_progress",
      "objectives_completed": 2,
      "objectives_total": 5,
      "priority": "high"
    }
  },
  "meta": {
    "confidence": 0.95,
    "calibration_id": "CAL-MB-2025-042"
  }
}
